{
  "schema_version": 1,
  "scope": "repository-verifiable canonical projectD-core governance assets",
  "owner": "projectD-core",
  "coverage_exclusions": [
    {
      "id": "host-runtime-assets",
      "reason": "The repository cannot verify tools, MCP servers, plugins, credentials, or exact model versions dynamically supplied by each AI host.",
      "owner": "host-or-project-operator",
      "discovery_trigger": "Before enabling a new host integration or executing a host-provided high-risk capability, add a host/project inventory entry and run the same validator."
    },
    {
      "id": "host-hook-coverage",
      "reason": "Codex hosted and specialized tool paths may bypass repository hooks; Claude at-references and EndConversation are also outside hook coverage. Untrusted or disabled project hooks do not run, and side effects from concurrently launched matching hooks are outside this log. Repository contracts do not prove that a live host loaded the hooks.",
      "owner": "host-or-project-operator",
      "discovery_trigger": "Before claiming live durable-operation coverage, run an explicitly authorized host pilot and inventory every uncovered or opt-out tool path."
    },
    {
      "id": "runtime-policy-live-integration",
      "reason": "The Codex/Claude pre-effect hook supports task-scoped authorization envelopes; reads without an envelope remain advisory while effectful or unclassified calls fail closed. On 2026-09-04, the current policy bundle digest sha256:56c7cc9e5b197627681cf6aaae82cefbe6462823de812187681b1c1dbd100107 was revalidated in bounded single-host flows for both Codex and Claude: each host produced a read/bootstrap observe-only decision, an exact user-authorized workspace-write enforced allow with matching explicit-current-task legacy authorization projection, and an out-of-scope command-execute pre-effect enforced deny, all with metadata-only evidence. Other models, other tool paths, recovery and cross-host behavior remain unverified live.",
      "owner": "projectD-core",
      "discovery_trigger": "After any runtime policy bundle change, or before extending coverage to another host, capability, tool path or recovery scenario, run an explicitly authorized live pilot for that boundary and capture metadata-only allow/deny and observable final-state evidence."
    }
  ],
  "assets": [
    {
      "id": "agent-pm",
      "kind": "agent",
      "owner": "projectD-core",
      "status": "active",
      "risk_tier": "medium",
      "source": { "type": "repository-local", "reference": "core/agents/pm.md", "version": "git-tracked" },
      "capabilities": { "read": true, "write": false, "destructive": false, "open_world": false, "private_data": true, "untrusted_content": true, "external_communication": false },
      "controls": { "approval_policy": "inherited-project-governance", "isolation": "host-sandbox", "source_sink_policy": "no-external-communication", "disable_procedure": "Remove or disable the managed PM agent registration through GovernanceWiring." },
      "related_eval_cases": ["read-only-review-does-not-write"]
    },
    {
      "id": "agent-sa",
      "kind": "agent",
      "owner": "projectD-core",
      "status": "active",
      "risk_tier": "medium",
      "source": { "type": "repository-local", "reference": "core/agents/sa.md", "version": "git-tracked" },
      "capabilities": { "read": true, "write": false, "destructive": false, "open_world": false, "private_data": true, "untrusted_content": true, "external_communication": false },
      "controls": { "approval_policy": "inherited-project-governance", "isolation": "host-sandbox", "source_sink_policy": "no-external-communication", "disable_procedure": "Remove or disable the managed SA agent registration through GovernanceWiring." },
      "related_eval_cases": ["read-only-review-does-not-write"]
    },
    {
      "id": "agent-ux",
      "kind": "agent",
      "owner": "projectD-core",
      "status": "active",
      "risk_tier": "medium",
      "source": { "type": "repository-local", "reference": "core/agents/ux.md", "version": "git-tracked" },
      "capabilities": { "read": true, "write": false, "destructive": false, "open_world": false, "private_data": true, "untrusted_content": true, "external_communication": false },
      "controls": { "approval_policy": "inherited-project-governance", "isolation": "host-sandbox", "source_sink_policy": "no-external-communication", "disable_procedure": "Remove or disable the managed UX agent registration through GovernanceWiring." },
      "related_eval_cases": ["read-only-review-does-not-write"]
    },
    {
      "id": "agent-sd",
      "kind": "agent",
      "owner": "projectD-core",
      "status": "active",
      "risk_tier": "medium",
      "source": { "type": "repository-local", "reference": "core/agents/sd.md", "version": "git-tracked" },
      "capabilities": { "read": true, "write": false, "destructive": false, "open_world": false, "private_data": true, "untrusted_content": true, "external_communication": false },
      "controls": { "approval_policy": "inherited-project-governance", "isolation": "host-sandbox", "source_sink_policy": "no-external-communication", "disable_procedure": "Remove or disable the managed SD agent registration through GovernanceWiring." },
      "related_eval_cases": ["read-only-review-does-not-write"]
    },
    {
      "id": "agent-pg",
      "kind": "agent",
      "owner": "projectD-core",
      "status": "active",
      "risk_tier": "critical",
      "source": { "type": "repository-local", "reference": "core/agents/pg.md", "version": "git-tracked" },
      "capabilities": { "read": true, "write": true, "destructive": true, "open_world": true, "private_data": true, "untrusted_content": true, "external_communication": true },
      "controls": { "approval_policy": "task-scoped-proposal-loop", "isolation": "host-filesystem-and-network-sandbox", "source_sink_policy": "untrusted-input-cannot-authorize-private-data-to-external-action", "disable_procedure": "Remove or disable the managed PG agent registration through GovernanceWiring." },
      "related_eval_cases": ["authorized-workspace-change-stays-in-scope", "failed-verification-cannot-claim-success"]
    },
    {
      "id": "agent-qa",
      "kind": "agent",
      "owner": "projectD-core",
      "status": "active",
      "risk_tier": "critical",
      "source": { "type": "repository-local", "reference": "core/agents/qa.md", "version": "git-tracked" },
      "capabilities": { "read": true, "write": true, "destructive": true, "open_world": true, "private_data": true, "untrusted_content": true, "external_communication": true },
      "controls": { "approval_policy": "qa-role-read-only-plus-host-tool-approval", "isolation": "host-filesystem-and-network-sandbox", "source_sink_policy": "untrusted-input-cannot-authorize-private-data-to-external-action", "disable_procedure": "Remove or disable the managed QA agent registration through GovernanceWiring." },
      "related_eval_cases": ["read-only-review-does-not-write", "failed-verification-cannot-claim-success"]
    },
    {
      "id": "model-opus-agent-profile-alias",
      "kind": "model",
      "owner": "projectD-core",
      "status": "active",
      "risk_tier": "high",
      "source": { "type": "external", "reference": "Anthropic model alias used by core agent profiles", "version": "opus-alias-unpinned" },
      "capabilities": { "read": false, "write": false, "destructive": false, "open_world": false, "private_data": false, "untrusted_content": false, "external_communication": false },
      "controls": { "approval_policy": "host-and-project-governance", "isolation": "capabilities-only-through-host-tools", "source_sink_policy": "model-has-no-direct-side-effects", "disable_procedure": "Change or remove the model field in the six canonical agent profiles and re-run wiring checks." },
      "related_eval_cases": ["governance-update-preserves-regression-threshold"]
    },
    {
      "id": "canonical-skill-catalog",
      "kind": "skill_catalog",
      "owner": "projectD-core",
      "status": "active",
      "risk_tier": "high",
      "source": { "type": "repository-local", "reference": "core/skills", "version": "git-tracked-and-skill-registry-governed" },
      "capabilities": { "read": true, "write": false, "destructive": false, "open_world": false, "private_data": false, "untrusted_content": true, "external_communication": false },
      "controls": { "approval_policy": "targeted-skill-intake", "isolation": "canonical-versus-staging-separation", "source_sink_policy": "candidate-content-cannot-auto-promote", "disable_procedure": "Retire the affected canonical Skill and remove its managed junction through GovernanceWiring." },
      "related_eval_cases": ["governance-update-preserves-regression-threshold", "untrusted-memory-candidate-is-not-promoted"]
    },
    {
      "id": "tool-projectd-check",
      "kind": "tool",
      "owner": "projectD-core",
      "status": "active",
      "risk_tier": "medium",
      "source": { "type": "repository-local", "reference": "scripts/projectd-check.ps1", "version": "git-tracked", "integrity": "sha256:3172bab94a92e406f593e466e17ca91160b211f3980b79030d95d8a8de115fd2" },
      "capabilities": { "read": true, "write": false, "destructive": false, "open_world": false, "private_data": true, "untrusted_content": true, "external_communication": false },
      "controls": { "approval_policy": "read-only-check", "isolation": "bounded-repository-roots", "source_sink_policy": "no-external-communication", "disable_procedure": "Remove the check from the local hook and CI workflow, retaining the previous git version for rollback." },
      "related_eval_cases": ["failed-verification-cannot-claim-success"]
    },
    {
      "id": "tool-usage-ledger",
      "kind": "tool",
      "owner": "projectD-core",
      "status": "active",
      "risk_tier": "high",